{
  "schema_version": 1,
  "name": "vector_module",
  "min_version": "0.5.0",
  "packages": {
    "linux": {
      "arch": {
        "official": [
          "openimageio"
        ],
        "aur": [
          "fastnoise2-git"
        ]
      },
      "fedora": {
        "copr": [
          "author/tools"
        ],
        "packages": [
          "OpenImageIO-devel"
        ]
      },
      "ubuntu": {
        "ppa": [
          "author/tools"
        ],
        "packages": [
          "libopenimageio-dev"
        ]
      }
    }
  }
}
