{
  "schema_version": 1,
  "name": "vector_module",
  "min_version": "0.5.0",
  "packages": {
    "windows": {
      "winget_sources": [
        {
          "name": "vendor",
          "url": "https://packages.vendor.example/api",
          "type": "Microsoft.Rest"
        }
      ],
      "winget": [
        "Author.Toolchain",
        {
          "id": "Vendor.Toolchain",
          "source": "vendor"
        }
      ],
      "vcpkg": [
        "openimageio",
        "fastnoise2"
      ]
    }
  }
}
